{
  "$schema": "https://create-turbo-stack.dev/schema/preset.json",
  "schemaVersion": "1.0",
  "name": "minimal",
  "version": "1.0.0",
  "description": "Minimal turborepo with one Next.js app and one UI package",
  "basics": {
    "projectName": "my-project",
    "packageManager": "bun",
    "scope": "@my-project",
    "typescript": "strict",
    "linter": "biome",
    "gitInit": true
  },
  "database": { "strategy": "none" },
  "api": { "strategy": "none" },
  "auth": { "provider": "none", "rbac": false, "entitlements": false },
  "css": {
    "framework": "tailwind4",
    "ui": "shadcn",
    "styling": "css-variables"
  },
  "integrations": {
    "analytics": "none",
    "errorTracking": "none",
    "email": "none",
    "rateLimit": "none",
    "ai": "none",
    "envValidation": true
  },
  "apps": [
    {
      "name": "web",
      "type": "nextjs",
      "port": 3000,
      "i18n": false,
      "consumes": ["ui"]
    }
  ],
  "packages": [
    {
      "name": "ui",
      "type": "react-library",
      "producesCSS": true,
      "exports": ["."]
    }
  ]
}
